[
  {
    "date": "2025-08-06",
    "title": "Change.org petition 'NON à la mise sur écoute de votre téléphone avec Chat Control' launched",
    "type": "civilno_drustvo",
    "actor": "Change.org / Christophe Boutry",
    "summary": "French citizen Christophe Boutry launches a Change.org petition against Chat Control, which would automatically scan private messages, photos and emails including encrypted ones; it eventually gathers over 118,000 signatures.",
    "source_url": "https://www.change.org/p/non-%C3%A0-la-mise-sur-%C3%A9coute-de-votre-t%C3%A9l%C3%A9phone-avec-chat-control",
    "source_name": "change.org",
    "eu_ref_url": null,
    "verified": true
  },
  {
    "date": "2025-09-01",
    "title": "CitizenGO petition 'Reject Chat Control! Stop EU Spying on Your Messages'",
    "type": "civilno_drustvo",
    "actor": "CitizenGO",
    "summary": "Earlier CitizenGO English-language petition calling on citizens to reject Chat Control and EU spying on private messages. (Approximate 2025 launch; exact date and signature count not confirmed via the JS-rendered page.)",
    "source_url": "https://citizengo.org/en-row/ot/16287-reject-chat-control--stop-eu-spying-on-your-messages",
    "source_name": "citizengo.org",
    "eu_ref_url": null,
    "verified": false
  },
  {
    "date": "2025-10-07",
    "title": "Signal calls on Germany to vote against Chat Control, threatens EU exit",
    "type": "civilno_drustvo",
    "actor": "Signal / Meredith Whittaker",
    "summary": "Signal President Meredith Whittaker publishes an open appeal urging Germany to reject Chat Control, warning that if forced to undermine encryption Signal would leave the EU market rather than comply.",
    "source_url": "https://therecord.media/signal-calls-on-germany-to-vote-no-chat-control-germany",
    "source_name": "therecord.media",
    "eu_ref_url": null,
    "verified": true
  },
  {
    "date": "2025-11-26",
    "title": "Reality Check: EU Council Chat Control vote is a green light for mass surveillance",
    "type": "civilno_drustvo",
    "actor": "Patrick Breyer",
    "summary": "After COREPER endorses a Council negotiating mandate, Breyer warns that Chat Control 'is not dead, it is just being privatized' — the text incentivizes voluntary mass scanning and mandatory age verification for all users.",
    "source_url": "https://www.patrick-breyer.de/en/reality-check-eu-council-chat-control-vote-is-not-a-retreat-but-a-green-light-for-indiscriminate-mass-surveillance-and-the-end-of-right-to-communicate-anonymously/",
    "source_name": "patrick-breyer.de",
    "eu_ref_url": null,
    "verified": true
  },
  {
    "date": "2026-02-23",
    "title": "Civil society open letter: 'We say no to Big Tech mass snooping on our messages'",
    "type": "civilno_drustvo",
    "actor": "EDRi + civil society coalition",
    "summary": "EDRi and dozens of civil society organisations publish an open letter urging the European Parliament to reject the second extension of the interim ePrivacy derogation ('Chat Control 1.0') that allows voluntary message scanning.",
    "source_url": "https://edri.org/our-work/open-letter-we-say-no-to-big-tech-mass-snooping-on-our-messages/",
    "source_name": "edri.org",
    "eu_ref_url": null,
    "verified": true
  },
  {
    "date": "2026-03-26",
    "title": "Historic vote: EU Parliament ends untargeted mass scanning of private chats",
    "type": "civilno_drustvo",
    "actor": "Patrick Breyer",
    "summary": "Breyer hails a 'sensational victory' as the European Parliament narrowly (307-306) rejects extending the interim scanning regime, letting it expire on 4 April 2026 and limiting any scanning to judicially suspected individuals.",
    "source_url": "https://www.patrick-breyer.de/en/historic-chat-control-vote-in-the-eu-parliament-meps-vote-to-end-untargeted-mass-scanning-of-private-chats/",
    "source_name": "patrick-breyer.de",
    "eu_ref_url": null,
    "verified": true
  },
  {
    "date": "2026-03-26",
    "title": "Petition update: 'Victoire ! Chat Control est officiellement enterré'",
    "type": "civilno_drustvo",
    "actor": "Change.org / Christophe Boutry",
    "summary": "L'organisateur de la pétition française annonce la victoire après le rejet de Chat Control par le Parlement européen le 26 mars 2026, fruit de mois de mobilisation citoyenne.",
    "source_url": "https://www.change.org/p/non-%C3%A0-la-mise-sur-%C3%A9coute-de-votre-t%C3%A9l%C3%A9phone-avec-chat-control/u/34427856",
    "source_name": "change.org",
    "eu_ref_url": null,
    "verified": true
  },
  {
    "date": "2026-06-28",
    "title": "'Double Threat' sparks relaunch of fightchatcontrol.eu",
    "type": "civilno_drustvo",
    "actor": "Patrick Breyer",
    "summary": "Breyer relaunches the campaign platform fightchatcontrol.eu warning of a 'double attack': an attempt to revive Chat Control 1.0 and imminent concessions in the Chat Control 2.0 trilogue (29 June 2026), enabling citizens to email lawmakers.",
    "source_url": "https://www.patrick-breyer.de/en/double-threat-to-private-communications-undemocratic-chat-control-backroom-deals-and-imminent-concessions-spark-relaunch-of-fightchatcontrol-eu/",
    "source_name": "patrick-breyer.de",
    "eu_ref_url": null,
    "verified": true
  },
  {
    "date": "2026-06-28",
    "title": "fightchatcontrol.eu campaign tool relaunched",
    "type": "civilno_drustvo",
    "actor": "fightchatcontrol.eu",
    "summary": "The fightchatcontrol.eu action platform is updated to let EU citizens directly email MEPs and government representatives with a template summarising the legal and technical flaws of Chat Control 1.0 and 2.0.",
    "source_url": "https://fightchatcontrol.eu/",
    "source_name": "fightchatcontrol.eu",
    "eu_ref_url": null,
    "verified": true
  },
  {
    "date": "2026-07-06",
    "title": "Procedural trick before summer recess pushes EU Parliament toward capitulation on Chat Control",
    "type": "civilno_drustvo",
    "actor": "Patrick Breyer",
    "summary": "Breyer denounces an EPP/Council-backed urgency procedure to revive the expired 'Chat Control 1.0' voluntary scanning regime, providing citizens a tool to lobby MEPs before the July 2026 votes.",
    "source_url": "https://www.patrick-breyer.de/en/procedural-trick-before-summer-recess-pushes-eu-parliament-towards-capitulation-on-chat-control/",
    "source_name": "patrick-breyer.de",
    "eu_ref_url": null,
    "verified": true
  },
  {
    "date": "2026-07-06",
    "title": "CitizenGO petition 'Nein zur Chatkontrolle – Stoppt den Überrumpelungsversuch!'",
    "type": "civilno_drustvo",
    "actor": "CitizenGO",
    "summary": "German-language CitizenGO petition mobilising against the last-minute July 2026 procedural attempt to reinstate Chat Control mass scanning of private messages. (Exact launch date and signature count not confirmed via the JS-rendered page.)",
    "source_url": "https://citizengo.org/de/ot/18633-nein-zur-chatkontrolle--stoppt-den-%C3%BCberrumpelungsversuch-",
    "source_name": "citizengo.org",
    "eu_ref_url": null,
    "verified": false
  },
  {
    "date": "2026-07-06",
    "title": "CitizenGO petition 'No to Chat Control'",
    "type": "civilno_drustvo",
    "actor": "CitizenGO",
    "summary": "English-language CitizenGO petition urging citizens to oppose the reintroduction of Chat Control mass surveillance of private communications during the July 2026 votes. (Exact launch date/signature count not confirmed via the JS-rendered page.)",
    "source_url": "https://citizengo.org/en-row/ot/18646-no-to-chat-control",
    "source_name": "citizengo.org",
    "eu_ref_url": null,
    "verified": false
  },
  {
    "date": "2026-07-07",
    "title": "CitizenGO Facebook: 'URGENT: European Parliament has voted to approve Chat Control by a narrow margin'",
    "type": "civilno_drustvo",
    "actor": "CitizenGO",
    "summary": "CitizenGO's alarmist Facebook post refers to the 7 July 2026 vote in which the Parliament approved (by roughly 331-304) the urgent procedure to fast-track revival of expired Chat Control 1.0 scanning rules — a procedural step, not final adoption, setting up the decisive 9-10 July vote.",
    "source_url": "https://www.facebook.com/citizengo/posts/-urgent-the-european-parliament-has-voted-to-approve-chat-control-by-a-narrow-ma/1478238287679331/",
    "source_name": "facebook.com",
    "eu_ref_url": null,
    "verified": true
  },
  {
    "date": "2026-07-07",
    "title": "Udruga Hrvatski ratnik: 'Ne kontroli razgovora (Chat Control) – Zaustavite pokušaj prepada!'",
    "type": "civilno_drustvo",
    "actor": "Udruga Hrvatski ratnik",
    "summary": "Udruga Hrvatski ratnik poziva građane da potpišu peticiju protiv Chat Controla, upozoravajući da bi automatska analiza privatnih poruka dovela do lažnih uzbuna i zloupotrebe vlasti; poveznica vodi na CitizenGO peticiju.",
    "source_url": "https://hrvatskiratnik.hr/ne-kontroli-razgovora-chat-control-zaustavite-pokusaj-prepada/",
    "source_name": "hrvatskiratnik.hr",
    "eu_ref_url": null,
    "verified": true
  },
  {
    "date": "2026-07-08",
    "title": "Petition update: 'Chat Control revient : vote décisif au Parlement européen ce jeudi 9 juillet'",
    "type": "civilno_drustvo",
    "actor": "Change.org / Christophe Boutry",
    "summary": "La pétition française est relancée, alertant que le Conseil de l'UE tente de ressusciter Chat Control 1.0 via un règlement quasi identique et appelant à mobiliser avant le vote décisif du Parlement européen le 9 juillet 2026.",
    "source_url": "https://www.change.org/p/non-%C3%A0-la-mise-sur-%C3%A9coute-de-votre-t%C3%A9l%C3%A9phone-avec-chat-control/u/34930761",
    "source_name": "change.org",
    "eu_ref_url": null,
    "verified": true
  }
]
