[
  {
    "date": "2025-07-31",
    "title": "Breyer: 'The vote is THIS October — Tell your government to #StopChatControl'",
    "type": "drustvene_mreze",
    "actor": "Patrick Breyer (@echo_pbreyer)",
    "summary": "Objava na X-u o procurjelom dokumentu prema kojem su mnoge zemlje koje su 2024. bile protiv Chat Controla sada neodlučne, uz poziv građanima da vrše pritisak na svoje vlade uoči glasanja u listopadu 2025.",
    "source_url": "https://x.com/echo_pbreyer/status/1950814065443422405",
    "source_name": "X",
    "eu_ref_url": null,
    "verified": true
  },
  {
    "date": "2025-08-21",
    "title": "CitizenGO Hrvatska kampanja/peticija 'Ne kontroli razgovora (Chat Control)'",
    "type": "drustvene_mreze",
    "actor": "CitizenGO Hrvatska (@CitizenGOhr)",
    "summary": "CitizenGO Hrvatska vodi peticiju i objave na Facebooku protiv plana Europske komisije da se softverom skeniraju sve privatne internetske poruke; poziva građane na potpisivanje i dijeljenje.",
    "source_url": "https://www.facebook.com/CitizenGOhr/",
    "source_name": "Facebook",
    "eu_ref_url": null,
    "verified": false
  },
  {
    "date": "2025-09-18",
    "title": "Sabor okrugli stol 'Očuvanje privatnosti u eri masovnog nadzora' (AI-obrađena verzija)",
    "type": "drustvene_mreze",
    "actor": "domovina.ai (obrada snimke Internet TV Hrvatskoga sabora)",
    "summary": "AI-obrađena (transkribirana i sažeta) verzija snimke saborskog okruglog stola o Chat Controlu u organizaciji Mosta/Nikole Grmoje, s izlaganjima o masovnom nadzoru komunikacije. Govornici: Grmoja, dr. Branimir Pervan, odvjetnik Luka Jurković i Luka Goleš Babić.",
    "source_url": "https://domovina.ai/v/pvbTxeZvzxs/",
    "source_name": "domovina.ai",
    "eu_ref_url": null,
    "verified": true
  },
  {
    "date": "2025-09-18",
    "title": "Okrugli stol o Chat Controlu u Hrvatskom saboru (izvorna YouTube snimka)",
    "type": "drustvene_mreze",
    "actor": "Internet TV Hrvatskoga sabora (YouTube)",
    "summary": "Izvorna snimka saborskog okruglog stola 'Očuvanje privatnosti u eri masovnog nadzora' koji je organizirao Most; YouTube id pvbTxeZvzxs, koji domovina.ai koristi kao izvor svoje obrade.",
    "source_url": "https://www.youtube.com/watch?v=pvbTxeZvzxs",
    "source_name": "YouTube",
    "eu_ref_url": null,
    "verified": true
  },
  {
    "date": "2025-10-08",
    "title": "Breyer slavi zaustavljanje Chat Controla: 'Protest works!'",
    "type": "drustvene_mreze",
    "actor": "Patrick Breyer (patrick-breyer.de / @echo_pbreyer)",
    "summary": "Breyer objavljuje da je građanski pritisak zaustavio glasanje o Chat Controlu zakazano za listopad 2025, jer je njemačka vlada odbila podržati prijedlog i time srušila potrebnu većinu u Vijeću EU.",
    "source_url": "https://www.patrick-breyer.de/en/citizen-protest-halts-chat-control-breyer-celebrates-major-victory-for-digital-privacy/",
    "source_name": "patrick-breyer.de",
    "eu_ref_url": null,
    "verified": true
  },
  {
    "date": "2025-11-07",
    "title": "Podcast Čušpajz #98 (Ivan Pokupec): 'Chat kontrola i dronovi pod krinkom sigurnosti'",
    "type": "drustvene_mreze",
    "actor": "Podcast Čušpajz / Ivan Pokupec",
    "summary": "Gost Ivan Pokupec smatra Chat Control gotovo neizbježnim, implementiranim pod izlikom borbe protiv pedofilije, i upozorava da se napadi na osobne slobode uvijek opravdavaju sigurnošću (usporedba s Patriot Actom).",
    "source_url": "https://domovina.ai/v/FCNEhaMRz98/",
    "source_name": "domovina.ai",
    "eu_ref_url": null,
    "verified": true
  },
  {
    "date": "2025-12-05",
    "title": "Podcast Čušpajz #102 (Krešimir Rotim): 'Chat control i cenzura suverenističkih ideja'",
    "type": "drustvene_mreze",
    "actor": "Podcast Čušpajz / Krešimir Rotim",
    "summary": "Rasprava o Chat Controlu kao alatu totalne kontrole i cenzure; kritika objašnjenja ministra Božinovića i 'demokratskog štita' EU, uz tvrdnju da se nadzor uvodi pod izlikom dječje pornografije.",
    "source_url": "https://domovina.ai/v/XhzpkkIkT20/",
    "source_name": "domovina.ai",
    "eu_ref_url": null,
    "verified": true
  },
  {
    "date": "2025-12-20",
    "title": "Sapere Aude izlaganje (Luka Goleš Babić): 'Chat Control – distopijski nadzor europskih poruka'",
    "type": "drustvene_mreze",
    "actor": "Sapere Aude / Luka Goleš Babić",
    "summary": "Goleš Babić detaljno objašnjava Chat Control kao distopijsku EU regulativu koja bi prisilila platforme na 'backdoor', spominje saborski okrugli stol s Mostom te pad prvog prijedloga u listopadu zahvaljujući Njemačkoj i brzo vraćanje nove verzije.",
    "source_url": "https://domovina.ai/v/rJgfIIekM1U/",
    "source_name": "domovina.ai",
    "eu_ref_url": null,
    "verified": true
  },
  {
    "date": "2025-12-26",
    "title": "Podcast Mrežnica (Goleš Babić): 'Chat Control i neizbrisiv digitalni otisak'",
    "type": "drustvene_mreze",
    "actor": "Radio Mrežnica / Luka Goleš Babić",
    "summary": "Goleš Babić navodi Chat Control kao konkretan primjer masovnog nadzora koji se 'pakira' u borbu protiv pedofilije, uz upozorenje o AI-profilaciji i nepostojanju anonimnosti na internetu.",
    "source_url": "https://domovina.ai/v/CPn5xARYfYg/",
    "source_name": "domovina.ai",
    "eu_ref_url": null,
    "verified": true
  },
  {
    "date": "2025-12-26",
    "title": "Podcast Čušpajz #106 (Luka Goleš Babić): 'Chat control, AI nadzor i opasnost za privatnost'",
    "type": "drustvene_mreze",
    "actor": "Podcast Čušpajz / Luka Goleš Babić",
    "summary": "Rasprava o Chat Controlu i digitalnom novcu kao dijelovima 'globalističke nevladavine'; naglasak da bi umjetna inteligencija, a ne čovjek, odlučivala koje se poruke proglašavaju sumnjivima i pohranjuju.",
    "source_url": "https://domovina.ai/v/Cw5uIg_sbQM/",
    "source_name": "domovina.ai",
    "eu_ref_url": null,
    "verified": true
  },
  {
    "date": "2026-06-25",
    "title": "Podcast Mladi za domovinu #110 (Goleš Babić): 'Bezličnost i gubitak privatnosti kroz Chat Control'",
    "type": "drustvene_mreze",
    "actor": "Mladi za domovinu / Luka Goleš Babić",
    "summary": "Goleš Babić povezuje Chat Control s 'tiranijom bez tiranina' (Arendt), navodi saborski okrugli stol s Mostom i upozorava da Meta/Instagram od petog mjeseca 2025. više ne enkriptira poruke pa savjetuje prestanak slanja poruka preko Instagrama.",
    "source_url": "https://domovina.ai/v/zZaW8UTn8as/",
    "source_name": "domovina.ai",
    "eu_ref_url": null,
    "verified": true
  },
  {
    "date": "2026-07-08",
    "title": "Grmoja poziva građane da na društvenim mrežama dijele apel eurozastupnicima protiv Chat Controla",
    "type": "drustvene_mreze",
    "actor": "Nikola Grmoja (@nikolagrmoja, Most)",
    "summary": "Grmoja poziva hrvatske eurozastupnike da glasaju protiv Chat Controla i traži od građana da u sljedeća 24 sata dijele njegovu izjavu na društvenim mrežama kako bi izvršili pritisak na predstavnike u Europskom parlamentu, ističući da EPP (u kojem je HDZ) najviše gura regulativu.",
    "source_url": "https://x.com/nikolagrmoja",
    "source_name": "X",
    "eu_ref_url": null,
    "verified": false
  }
]
