[
  {
    "date": "2025-08-21",
    "title": "MOST pokrenuo peticiju protiv zakona Chat Control",
    "type": "izjava_politicara",
    "actor": "MOST",
    "summary": "MOST je pokrenuo peticiju izražavajući odlučan otpor prijedlogu Chat Controla, tvrdeći da uvodi masovni nadzor nevinih građana, ugrožava privatnost i slobodu izražavanja te je neučinkovit jer će ga kriminalci lako zaobići.",
    "source_url": "https://most-hrvatska.hr/2025/08/21/peticija-protiv-zakona-chat-control/",
    "source_name": "MOST (službena stranica)",
    "eu_ref_url": null,
    "verified": true
  },
  {
    "date": "2025-08-21",
    "title": "SDP poziva Vladu da glasa protiv, Plenković uzvraća 'SDP laže'",
    "type": "izjava_politicara",
    "actor": "Siniša Hajdaš Dončić (SDP)",
    "summary": "Predsjednik SDP-a Siniša Hajdaš Dončić pozvao je Vladu da povuče podršku uredbi Chat Control jer krši pravo na privatnost, dok je premijer Andrej Plenković odbacio kritike izjavom da 'SDP laže' da Vlada želi kontrolirati poruke građana.",
    "source_url": "https://vijesti.hrt.hr/eu/sdp-poziva-vladu-da-glasa-protiv-europskog-zakona-o-masovnom-nadzoru--12299362",
    "source_name": "HRT Vijesti",
    "eu_ref_url": null,
    "verified": true
  },
  {
    "date": "2025-08-30",
    "title": "Grmoja upozorava: 'Tko god se smatra prijetnjom može se naći na udaru'",
    "type": "izjava_politicara",
    "actor": "Nikola Grmoja (MOST)",
    "summary": "Nikola Grmoja upozorio je da Chat Control otvara put zloupotrebi jer bi se svatko tko se smatra prijetnjom vladajućoj strukturi mogao naći na udaru nadzora, dok Vlada još nije zauzela jasan stav.",
    "source_url": "https://dnevnik.hr/vijesti/hrvatska/lome-se-koplja-oko-chat-controla-vlada-jos-nije-zauzela-stav-tko-god-se-smatra-prijetnjom-moze-se-naci-na-udaru---931983.html",
    "source_name": "Dnevnik.hr",
    "eu_ref_url": null,
    "verified": true
  },
  {
    "date": "2025-08-30",
    "title": "Ressler: Vlada još nema stav, Parlament protiv masovnog nadzora",
    "type": "izjava_politicara",
    "actor": "Karlo Ressler (HDZ, EPP)",
    "summary": "Eurozastupnik HDZ-a Karlo Ressler naglasio je da je sprječavanje zlostavljanja djece prioritet, ali da je Europski parlament jasan da ne smije biti masovnog nadzora komunikacija građana te da se to očekuje i od Vijeća.",
    "source_url": "https://dnevnik.hr/vijesti/hrvatska/lome-se-koplja-oko-chat-controla-vlada-jos-nije-zauzela-stav-tko-god-se-smatra-prijetnjom-moze-se-naci-na-udaru---931983.html#ressler",
    "source_name": "Dnevnik.hr",
    "eu_ref_url": null,
    "verified": true
  },
  {
    "date": "2025-08-30",
    "title": "Bosanac (Možemo): ciljati osumnjičene predatore, ne sve građane",
    "type": "izjava_politicara",
    "actor": "Gordan Bosanac (Možemo)",
    "summary": "Zastupnik Možemo Gordan Bosanac zalagao se za ciljano praćenje osumnjičenih počinitelja umjesto masovnog nadzora svih građana kao rješenja protiv zlostavljanja djece na internetu.",
    "source_url": "https://dnevnik.hr/vijesti/hrvatska/lome-se-koplja-oko-chat-controla-vlada-jos-nije-zauzela-stav-tko-god-se-smatra-prijetnjom-moze-se-naci-na-udaru---931983.html#bosanac",
    "source_name": "Dnevnik.hr",
    "eu_ref_url": null,
    "verified": true
  },
  {
    "date": "2025-09-18",
    "title": "Okrugli stol Mosta u Saboru: 'Jednom kada ukinemo privatnost, ukidamo i demokraciju'",
    "type": "okrugli_stol",
    "actor": "MOST / Nikola Grmoja",
    "summary": "Klub zastupnika Mosta organizirao je u Hrvatskom saboru okrugli stol o EU regulativi Chat Control uz sudjelovanje dr. Branimira Pervana, odvjetnika Luke Jurkovića i Luke Goleša Babića; zaključak je bio da uredba ne štiti djecu nego normalizira masovni nadzor.",
    "source_url": "https://www.sabor.hr/hr/press/priopcenja/na-okruglom-stolu-u-organizaciji-mosta-raspravljano-o-prijedlogu-regulative-eu",
    "source_name": "Hrvatski sabor (priopćenje)",
    "eu_ref_url": null,
    "verified": true
  },
  {
    "date": "2025-09-19",
    "title": "MOST objavio izvještaj s okruglog stola o Chat Controlu",
    "type": "okrugli_stol",
    "actor": "MOST",
    "summary": "MOST je na svojim stranicama objavio izvještaj s okruglog stola navodeći da je prikupljeno više od 6.500 potpisa peticije 'Stop Chat Control' te da regulativa vodi skeniranju privatnih poruka, e-pošte i fotografija svih građana.",
    "source_url": "https://most-hrvatska.hr/2025/09/19/okrugli-stol-o-regulativi-chat-control-jednom-kad-ukinemo-privatnost-ukidamo-i-demokraciju/",
    "source_name": "MOST (službena stranica)",
    "eu_ref_url": null,
    "verified": true
  },
  {
    "date": "2025-10-14",
    "title": "Božinović: 'Hrvatska protiv masovnog nadzora, ali i šutnje pred zlostavljanjem djece'",
    "type": "izjava_politicara",
    "actor": "Davor Božinović (HDZ, ministar unutarnjih poslova)",
    "summary": "Ministar Davor Božinović branio je regulativu tvrdeći da 'ova uredba ne predviđa nikakav masovni nadzor komunikacija' te da to ni ne mogu činiti države nego samo platforme; naglasio je da policija godišnje dobiva desetak tisuća prijava materijala o zlostavljanju djece.",
    "source_url": "https://mup.gov.hr/vijesti/bozinovic-hrvatska-protiv-masovnog-nadzora-ali-i-sutnje-pred-zlostavljanjem-djece/295027",
    "source_name": "Ministarstvo unutarnjih poslova RH",
    "eu_ref_url": null,
    "verified": true
  },
  {
    "date": "2025-10-14",
    "title": "EU povukla Chat Control s dnevnog reda, SDP slavi 'pobjedu protiv HDZ-a'",
    "type": "izjava_politicara",
    "actor": "Arsen Bauk (SDP)",
    "summary": "Nakon što je dansko predsjedništvo povuklo Chat Control s dnevnog reda Vijeća EU, zastupnik SDP-a Arsen Bauk to je proslavio kao 'pobjedu protiv špijunaže i HDZ-a' te poručio da Vlada mora objasniti građanima zašto je šutjela i podržavala loš prijedlog.",
    "source_url": "https://net.hr/danas/rtl-danas/eu-povukla-chat-control-s-dnevnog-reda-u-hrvatskoj-likuju-pobjeda-protiv-spijunaze-i-hdz-a-fcbea289-a90c-11f0-8210-9600040c8f8e#bauk",
    "source_name": "Net.hr / RTL Danas",
    "eu_ref_url": null,
    "verified": true
  },
  {
    "date": "2025-11-19",
    "title": "Transkript otkrio da je Hrvatska tražila probijanje enkripcije",
    "type": "izjava_politicara",
    "actor": "Vlada RH",
    "summary": "Procurjeli transkript sa sastanka u EU-u pokazao je da je hrvatski predstavnik zagovarao probijanje end-to-end enkripcije i obveznu dostavu komunikacija, suprotno javnim tvrdnjama Plenkovića i Božinovića da Hrvatska ne podržava masovni nadzor.",
    "source_url": "https://www.index.hr/vijesti/clanak/vlada-tvrdi-da-ne-zeli-citati-sve-nase-poruke-ovo-je-dokaz-da-lazu/2732097.aspx#transkript",
    "source_name": "Index.hr",
    "eu_ref_url": null,
    "verified": true
  },
  {
    "date": "2026-07-08",
    "title": "Grmoja: chat control je 'put u nadzor svih građana'",
    "type": "izjava_politicara",
    "actor": "Nikola Grmoja (MOST)",
    "summary": "Grmoja je ponovio da je chat control put u nadzor svih građana te da se ništa njime neće riješiti u obračunu sa seksualnim prijestupnicima, pozivajući eurozastupnike da glasaju protiv.",
    "source_url": "https://www.novilist.hr/novosti/grmoja-pozivam-eurozastupnike-da-glasaju-protiv-chat-controla-to-je-put-u-nadzor-svih-gradana/",
    "source_name": "Novi list",
    "eu_ref_url": null,
    "verified": true
  },
  {
    "date": "2026-07-09",
    "title": "Grmoja nakon usvajanja: 'Danas je ozakonjeno masovno špijuniranje milijuna Europljana'",
    "type": "izjava_politicara",
    "actor": "Nikola Grmoja (MOST)",
    "summary": "Reagirajući na ishod, Grmoja je poručio: 'Danas je ozakonjeno masovno špijuniranje milijuna Europljana, pa tako i hrvatskih građana. Ono što je dobro da je prošao amandman o zaštiti enkripcije, ali će oni nastaviti gurati chat control 2 koji je još pogubniji.'",
    "source_url": "https://dnevnik.hr/vijesti/svijet/europski-parlament-izglasao-privremenu-mjeru-za-nadzor-komunikacije---990465.html",
    "source_name": "Dnevnik.hr",
    "eu_ref_url": null,
    "verified": true
  }
]
